{
  "phase": "phase-16",
  "attempt": 1,
  "timestamp": "2026-06-11T11:31:39Z",
  "agent": "codex",
  "backend": "codex",
  "verdict": "fail",
  "confidence": 92,
  "findings": [
    {
      "severity": "critical",
      "location": "git history 5ffaa64..HEAD",
      "description": "Phase 16 history contains a checkpoint commit despite the success criterion requiring zero checkpoint commits for this phase.",
      "evidence": "git log --oneline 5ffaa64..HEAD --grep='checkpoint:' returned 316512e checkpoint: before next-loop cycle"
    }
  ],
  "loops_to_revert": [
    "ralph-loop-066"
  ],
  "failure_notes": [
    "Do not create checkpoint commits during the retry; use checkpoint/loop-NNN lightweight tags only.",
    "Re-run the phase-history check with git log --oneline 5ffaa64..HEAD --grep='checkpoint:' and require no Phase 16 checkpoint commits before gate."
  ],
  "phase_title": "Trust the Machinery",
  "criteria_outcomes": [
    {
      "criterion": "install_audit.py reports all three layers current on this machine after /sync-install; CI runs the source\u2194project check and blocks on drift.",
      "status": "deferred",
      "evidence": "source/project verified current by python -m platforms.python.install_audit --layers source,project --root .; CI has .github/workflows/ci.yml:111 running source,project. Global ~/.claude layer is outside reviewer scope.",
      "deferred_to": "main-thread-verified"
    },
    {
      "criterion": "A planted stale project copy makes install_audit exit non-zero; EOL-only differences do NOT trip it.",
      "status": "deferred",
      "evidence": "Static coverage present in platforms/python/tests/test_install_audit.py for stale detection and EOL-insensitivity, but executable pytest verification was blocked by read-only sandbox temp-file failure.",
      "deferred_to": "in-house executable verification"
    },
    {
      "criterion": "A live /next-loop run during this phase appends a loop_complete event to history.jsonl in greppable compact JSON.",
      "status": "met",
      "evidence": ".advanced-plans/state/history.jsonl lines 24-27 contain compact JSON loop_complete events for phase-16 loops 065-068."
    },
    {
      "criterion": "ralph-loop-worker.md and ralph-orchestrator.md (source + installed copies) contain the three contract guards; no per-spawn hand-injection needed.",
      "status": "met",
      "evidence": "Hard Contract sections present in platforms/claude-code/agents and .claude/agents copies; Get-FileHash parity confirmed source/runtime files match."
    },
    {
      "criterion": "The fast-path demonstrably skips the orchestrator on a populated loop (printed marker + no Agent spawn), and a stub loop still routes to the agent.",
      "status": "deferred",
      "evidence": "next-loop.md documents FAST_PATH_RESULT=ok with '-> fast-path: loop already populated, orchestrator skipped' and agent_needed path for stubs; executable branch proof blocked by read-only sandbox.",
      "deferred_to": "in-house executable verification"
    },
    {
      "criterion": "Phase 16's own history contains zero checkpoint: commits; checkpoint/loop-NNN tags exist instead; execution.log is untracked.",
      "status": "failed",
      "evidence": "checkpoint/loop-064 through checkpoint/loop-068 tags exist and execution.log is ignored/untracked, but git log 5ffaa64..HEAD --grep='checkpoint:' returned 316512e checkpoint: before next-loop cycle."
    },
    {
      "criterion": "All 15 prior phases have complete.md + a PLANS-INDEX manifest entry; pre-gate phases use the sentinel form; every bullet has an evidence pointer.",
      "status": "met",
      "evidence": "phase-1 through phase-15 complete.md files all exist; PLANS-INDEX has entries for phases 1-15; pre-gate complete.md files include gate_verdict_ref sentinel form."
    },
    {
      "criterion": "A gate-pass closeout produces compaction artefacts without a separate /phase-compact invocation (this phase's own gate, or a witnessed simulation).",
      "status": "met",
      "evidence": "platforms/claude-code/commands/run-gate.md Step 10.4 writes complete.md, PLANS-INDEX entry, and handoff.md, commits compaction artefacts, and states no separate /phase-compact call is needed."
    },
    {
      "criterion": "Full suite green (pytest 3.10\u20133.12), AST zero-dep NONE, path_audit CLEAN, LOCKED schema docs byte-unchanged, no platform paths in core/.",
      "status": "deferred",
      "evidence": "AST CI-style command returned NONE; path_audit returned CLEAN; protected schema/module diff vs 5ffaa64 was empty. pytest was blocked by read-only sandbox temp-file failure.",
      "deferred_to": "in-house executable verification"
    },
    {
      "criterion": "v0.16.0 cut; every friction-log entry resolved this phase struck through with a Loop 064\u2013068 resolution note.",
      "status": "met",
      "evidence": "VERSION is 0.16.0; CHANGELOG.md has [0.16.0]; docs/tool-friction-log.md contains struck-through resolved entries with Loop 065/066 notes and run-gate prints git push origin main --follow-tags."
    }
  ]
}